{
  "$schema": "https://raw.githubusercontent.com/Mahfoud-Sa/tik-tak-to/main/schemas/version-manifest.schema.json",
  "schema_version": 1,
  "name": "XO Game",
  "version": "5.0.0",
  "tag_name": "v5.0.0",
  "channel": "stable",
  "published_at": "2026-10-02T07:44:22Z",
  "mandatory": false,
  "release_notes": "Initial Release",
  "release_page_url": "https://github.com/Mahfoud-Sa/tik-tak-to/releases/tag/v5.0.0",
  "platforms": {
    "windows": {
      "file_name": "XO_Game-windows-x64.zip",
      "download_url": "https://github.com/Mahfoud-Sa/tik-tak-to/releases/download/v5.0.0/XO_Game-windows-x64.zip",
      "sha256": ""
    }
  }
}